6;Câu 5; Tại sao ta chuyển từ chiến lược đánh Pháp sang chiến lược hòa hoãn nhân nhượng Pháp?;A. Vì Pháp và Tưởng đã bắt tay cấu kết với nhau chống ta.;B. Vì Pháp được bọn phản động tay sai giúp đỡ.;C. Vì ta tránh tình trạng một lúc đối phó với nhiều kẻ thù.;D. Vì Pháp được Anh hậu thuẫn.;A
6;Câu 6; Loại công cụ lao động nào do cuộc cách mạng khoa học kĩ thuật lần thứ hai tạo nên đã được xem như “trung tâm thần kinh” kĩ thuật, thay con người trong toàn bộ quá trình sản xuất liên tục?;A. “Người máy” (Rô-bốt).;B. Máy tính điện tử.;C. Hệ thống máy tự động.;D. Máy tự động.;B
6;Câu 7; Phong trào yêu nước dân chủ công khai diễn ra vào năm 1924-1925, là phong trào nào?;A. Tiếng bom của Phạm Hồng Thái và đấu tranh đòi thả tự do cho cụ Phan Bội Châu.;B. Xuất bản những tờ báo tiến bộ và lập ra nhà xuất bản tiến bộ.;C. Cuộc đấu tranh đòi nhà cầm quyền Pháp thả cụ Phan Bội Châu và đám tang cụ Phan Chu Trinh.;D. Tiếng bom của Phạm Hồng Thái và đám tang cụ Phan Chu Trinh.;A
6;Câu 8; Nhật xâm lược Đông Dương, Pháp đầu hàng Nhật, Nhật lấn dần từng bước để;A. Biến Đông Dương thành thuộc địa của Nhật.;B. Để làm bàn đạp tấn công nước khác.;C. Biến Đông Dương thành thuộc địa và căn cứ chiến tranh của Nhật.;D. Để độc quyền chiếm Đông Dương.;C
6;Câu 9; Sau Chiến tranh thế giới thứ hai, Liên Xô tiến hành khôi phục kinh tế trong điều kiện;A. Bị tổn thất nặng nề trong chiến tranh.;B. Bán được nhiều vũ khí, thu được nhiều lợi nhuận trong chiến tranh.;C. Chiếm được nhiều thuộc địa.;D. Thu được nhiều chiến phí.;A
6;Câu 10; Ai được bầu làm Tổng bí thư của Đảng tại Đại hội Đảng lần thứ II?;A. Hồ Chí Minh.;B. Phạm Văn Đồng.;C. Trường Chinh.;D. Trần Phú.;C
6;Câu 11; Cuộc cách mạng khoa học kĩ thuật lần thứ hai đã gây ra những hậu quả tiêu cực đến đời sống con người như thế nào?;A. Đưa con người trở về nền văn minh nông nghiệp.;B. Tài nguyên cạn kiệt, môi trường ô nhiễm nặng.;C. Cơ cấu dân cư thay đổi.;D. Lao động dịch vụ và trí óc tăng lên.;B
6;Câu 12; Trong “Việt Nam hóa chiến tranh’’, lực lượng nào là chủ yếu để tiến hành chiến tranh?;A. Quân đội Mĩ.;B. Quân đội ngụy.;C. Quân đội Mĩ + các đồng minh.;D. Quân đội Mĩ + Quân đội ngụy.;B
6;Câu 13; Thắng lợi này chứng minh sự trưởng thành của quân đội ta và cuộc kháng chiến từ thế phòng ngự sang thế tiến công. Đó là ý nghĩa lịch sử của chiến dịch nào?;A. Chiến dịch Biên giới 1950.;B. Chiến dịch Việt Bắc 1947.;C. Chiến dịch Tây Bắc 1952.;D. Chiến dịch Điện Biên Phủ 1954.;A
6;Câu 14; Tập đoàn cứ điểm Điện Biên Phủ được chia thành;A. 49 cứ điểm và 3 phân khu.;B. 55 cứ điểm và 3 phân khu.;C. 45 cứ điểm và 3 phân khu.;D. 50 cứ điểm và 3 phân khu.;A
6;Câu 15; Kẻ thù nào dọn đường tiếp tay cho thực dân Pháp quay trở lại xâm lược nước ta?;A. Bọn Việt Quốc, Việt Cách.;B. Các lực lượng phản cách mạng trong nước.;C. Bọn Nhật đang còn tại Việt Nam.;D. Đế quốc Anh và quân Nhật còn lại ở Việt Nam.;D
6;Câu 16; Nguyên nhân nào là cơ bản nhất thúc đẩy nền kinh tế Mĩ phát triển nhanh chóng sau Chiến tranh thế giới thứ hai?;A. Tập trung sản xuất và tư bản cao.;B. Mĩ giàu lên nhờ buôn bán vũ khí cho các nước tham chiến.;C. Tài nguyên thiên nhiên phong phú.;D. Áp dụng các thành tựu của cách mạng khoa học-kỹ thuật.;D
6;Câu 17; Nhằm độc quyền chiếm thị trường Đông Dương, tư bản độc quyền Pháp đã làm gì?;A. Chỉ nhập hàng hóa Pháp vào thị trường Đông Dương.;B. Cản trở hoạt động của tư bản Trung Quốc, Nhật Bản.;C. Lập ngân hàng Đông Dương.;D. Ban hành đạo luật đánh thuế nặng các hàng hóa nước ngoài nhập vào Đông Dương.;D
6;Câu 18; Nhật đảo chính Pháp vào thời điểm nào sau đây?;A. Sáng mồng 9/3/1945.;B. Đêm mồng 9/3/1945.;C. Ngày 9/3/1945.;D. Trưa mồng 9/3/1945.;B
6;Câu 19; Năm 1994, ASEAN thành lập Diễn đàn khu vực (ARF) nhằm mục đích gì?;A. Hợp tác với tất cả các nước ở Châu Á.;B. Hợp tác với tất cả các nước trên thế giới.;C. Tạo nên một môi trường hòa bình ổn định cho công cuộc hợp tác phát triển của Đông Nam Á.;D. Hợp tác trong khu vực Châu Á – Thái Bình Dương.;C
6;Câu 20; Vì sao Mĩ buộc phải tuyên bố “Mĩ hóa” trở lại chiến tranh xâm lược và thừa nhận sự thất bại của “Việt Nam hóa chiến tranh”?;A. Do thắng lợi liên tiếp của ta trên các mắt trận quân sự, trong 3 năm 1969, 1970, 1971.;B. Cuộc tiến công chiến lược năm 1972 ta đã giáng đòn nặng nề vào chiến lược “Việt Nam hóa chiến tranh”.;C. Thắng lợi của ta trên mặt trận ngoại giao ở Pari.;D. Miền Bắc khắc phục hậu quả chiến tranh phá hoại lần thứ nhất, tiếp tục chi viện cho miền Nam.;B
6;Câu 21; Sự kiện nào là quan trọng nhất trong quá trình thống nhất đất nước về mặt Nhà nước sau 1975?;A. Hội nghị Hiệp thương của đại biểu 2 miền Bắc Nam tại Sài Gòn (11/1975).;B. Tổng tuyển cử bầu Quốc hội chung trong cả nước (25/4/1976).;C. Quốc hội khóa VI của nước Việt Nam thống nhất kỳ họp đầu tiên (24/6-2/7/1976).;D. Đại hội thống nhất Mặt trận tổ quốc Việt Nam.;C
6;Câu 22; Kế hoạch giải phóng miền Nam được Bộ Chính trị Trung ương Đảng đề ra trong 2 năm, đó là 2 năm nào?;A. 1974 – 1975.;B. 1975 – 1976.;C. 1972 – 1973.;D. 1973 – 1974.;B
6;Câu 23; Tính chất chính nghĩa của cuộc kháng chiến biểu hiện ở điểm nào?;A. Nội dung của đường lối kháng chiến của ta.;B. Chủ trương sách lược của Đảng ta.;C. Mục đích cuộc kháng chiến của ta là tự vệ chính nghĩa.;D. Quyết tâm kháng chiến của toàn thể dân tộc ta.;C
6;Câu 24; Mục tiêu đấu tranh của Việt Nam Quốc dân Đảng là gì?;A. Đánh đuổi thực dân Pháp, thiết lập dân quyền.;B. Đánh đuổi thực dân Pháp, đánh đổ ngôi vua, thiết lập dân quyền.;C. Đánh đuổi thực dân Pháp, xóa bỏ ngôi vua.;D. Đánh đuổi thực dân Pháp, lập nên nước Việt Nam độc lập.;B
6;Câu 25; Vì sao cuối năm 1928 đầu năm 1929 những người Cộng sản Việt Nam thấy cần thiết phải thành lập một Đảng Cộng sản để lãnh đạo phong trào đấu tranh giành độc lập, tự do cho dân tộc?;A. Trước sự thất bại của cuộc khởi nghĩa Yên Bái, Việt Nam Quốc dân Đảng tan rã.;B. Do phong trào dân tộc dân chủ ở nước ta phát triển mạnh.;C. Sự phát triển mạnh của Hội Việt Nam cách mạng thanh niên và Tân Việt.;D. Do phong trào dân tộc và dân chủ ở nước ta, đặc biệt là phong trào công nông theo con đường cách mạng vô sản phát triển mạnh.;D
6;Câu 26; Mục đích của chủ trương “vô sản hóa’’ của Hội Việt Nam cách mạng thanh niên là gì?;A. Rèn luyện tính kỷ luật cho hội viên.;B. Hội viên sống gần gũi với quần chúng.;C. Đưa hội viên vào các nhà máy, hầm mỏ, đồn điền cùng sống lao động với công nhân để tự rèn luyện, đồng thời truyền bá chủ nghĩa Mác - Lê nin.;D. Xây dựng phong trào cách mạng ở tận cơ sở.;C
6;Câu 27; Ý nghĩa tích cực và bao quát nhất của Cộng đồng Kinh tế châu Âu (EEC) ra đời từ 1957?;A. Tiến tới thống nhất chính sách đối nội đối ngoại giữa các nước trong cộng đồng.;B. Phát hành đồng tiền chung.;C. Có điều kiện để cạnh tranh kinh tế, thương mại tài chính với Mĩ và Nhật.;D. Tạo ra ở châu Âu một cộng đồng Kinh tế và một thị trường chung để đẩy mạnh phát triển kinh tế và ứng dụng thành tựu khoa học kĩ thuật.;D
6;Câu 28; Có tổ chức nào không tham gia Hội nghị thành lập Đảng?;A. Đông Dương Cộng sản Liên đoàn.;B. An Nam Cộng sản đảng.;C. Hội Việt Nam cách mạng thanh niên.;D. Đông Dương Cộng sản Đảng.;A
6;Câu 29; Tội ác lớn nhất của chủ nghĩa A-pác-thai ở châu Phi là gì?;A. Bóc lột tàn bạo người da đen.;B. Gây chia rẽ nội bộ người Nam Phi.;C. Tước quyền tự do của người da đen.;D. Phân biệt chủng tộc và kỳ thị chủng tộc đối với người da đen.;D
6;Câu 30; Nước được mệnh danh là “Lá cờ đầu trong phong trào giải phóng dân tộc Mĩ La-tinh”?;A. Ac-hen-ti-na.;B. Braxin.;C. Cu Ba.;D. Mê-hi-cô.;C
6;Câu 31; Điều gì chứng tỏ: tháng 9/1930 phong trào công nông đã phát triển tới đỉnh cao?;A. Đã thực hiện liên minh công nông vững chắc.;B. Phong trào diễn ra khắp cả nước.;C. Sử dụng hình thức đấu tranh vũ trang và thành lập chính quyền Xô Viết.;D. Đã kết hợp đấu tranh chính trị và đấu tranh vũ trang.;C
6;Câu 32; Đặc điểm nào sau đây là đặc điểm nổi bật trong quan hệ đối ngoại của Nhật Bản sau Chiến tranh thế giới thứ hai?;A. Không đưa quân đi tham chiến ở nước ngoài.;B. Kí hiệp ước an ninh Mĩ-Nhật (08/09/1951).;C. Cạnh tranh gay gắt với Mĩ và các nước Tây Âu.;D. Phát triển kinh tế đối ngoại, xâm nhập và mở rộng phạm vi thế lực bằng kinh tế ở khắp mọi nơi đặc biệt là Đông Nam Á.;B
6;Câu 33; Khẩu hiệu “Đánh đuổi Nhật-Pháp” được thay bằng khẩu hiệu “Đánh đuổi phát xít Nhật” được nêu trong;A. Hội nghị toàn quốc của Đảng (13-15/8/1945).;B. Chỉ thị “Nhật – Pháp bắn nhau và hành động của chúng ta” (12/3/1945).;C. Đại hội quốc dân ở Tân Trào (16/8/1945).;D. Hội nghị Ban Thường vụ Trung ương Đảng (9/3/1945).;B
6;Câu 34; Năm 1989 diễn ra sự kiện gì có liên quan đến quan hệ quốc tế?;A. Mĩ và Liên Xô tuyên bố chấm dứt “Chiến tranh lạnh”.;B. Trật tự hai cực I-an-ta bị xói mòn.;C. Trật tự hai cực I-an-ta bị sụp đổ.;D. Xô – Mĩ tuyên bố hợp tác trên mọi phương diện.;A
6;Câu 35; Chiến thuật được sử dụng trong “Chiến tranh đặc biệt” là gì?;A. “Trực thăng vận”, “thiết xa vận”.;B. Gom dân, lập “ấp chiến lược”.;C. “Bình định” toàn bộ Miền Nam.;D. Càn quét tiêu diệt lực lượng cách mạng.;A
6;Câu 36; Năm 1936 Đảng ta chủ trương thành lập mặt trận gì?;A. Mặt trận Dân chủ Đông Dương.;B. Mặt trận Dân chủ thống nhất Đông Dương.;C. Mặt trận Nhân dân phản đế Đông Dương.;D. Mặt trận nhân dân Đông Dương.;C
6;Câu 37; Giai cấp nào trở thành tay sai, là m chỗ dựa cho thực dân Pháp tăng cường chiếm đoạt, bóc lột kinh tế, đàn áp chính trị đối với người nông dân?;A. Giai cấp địa chủ phong kiến.;B. Tầng lớp đại địa chủ.;C. Tầng lớp tư sản mại bản.;D. Giai cấp tư sản dân tộc.;B
6;Câu 38; Qua đợt cải cách ruộng đất ở miền Bắc đã thực hiện triệt để khẩu hiệu nào?;A. “Tấc đất, tấc vàng”.;B. “Tăng gia sản xuất nhanh, tăng gia sản xuất nữa”.;C. “Độc lập dân tộc” và “Ruộng đất dân cày”.;D. “Người cày có ruộng”.;D
6;Câu 39; Quyết định Tổng khởi nghĩa trong cả nước, giành chính quyền trước khi quân Đồng minh vào Việt Nam. Đó là nội dung của Nghị quyết nào?;A. Nghị quyết của Ban Thường vụ Trung ương Đảng họp ngay đêm 9/3/1945.;B. Nghị quyết của Đại hội quốc dân ở Tân Trào.;C. Nghị quyết của Đảng tại Hội nghị toàn quốc (13-15/8/1945).;D. Nghị quyết của Hội nghị Trung ương Đảng lần VIII (10-19/5/1941).;C
6;Câu 40; Nguyên nhân cơ bản nhất quyết định sự thắng lợi cuộc kháng chiến chống thực dân Pháp (1945-1954)?;A. Sự lãnh đạo sáng suốt của Đảng đứng đầu là Chủ tịch Hồ Chí Minh với một đường lối chính trị, quân sự, kháng chiến đúng đắn, sáng tạo.;B. Truyền thống yêu nước, anh hùng bất khuất của dân tộc.;C. Có hậu phương vững chắc và khối đoàn kết toàn dân.;D. Tình đoàn kết chiến đấu của nhân dân 3 nước Đông Dương và sự ủng hộ của nhân dân tiến bộ thế giới.;A


7;Câu 1; Tham gia bầu cử Quốc hội và Hội đồng nhân dân là thực hiện quyền gì?;A. Quyền tự do, dân chủ.;B. Quyền làm chủ đất nước.;C. Quyền làm chủ tập thể.;D. Quyền ứng cử, bầu cử.;B
7;Câu 2; Những hoạt động nào của Hội Việt Nam cách mạng thanh niên gắn bó mật thiết với vai trò của Nguyễn Ái Quốc?;A. Chủ trương phong trào “vô sản hóa”.;B. Mở lớp tập huấn chính trị đào tạo cán bộ tại Quảng Châu ra báo “Thanh niên”.;C. Sự ra đời của một số đoàn thể quần chúng như: Công hội, Nông hội, Hội phụ nữ...;D. Bí mật chuyển các tác phẩm của Nguyễn Ái Quốc về nước.;B
7;Câu 3; Nước Cộng hòa Nhân dân Trung Hoa thành lập 1949 do ai đứng đầu?;A. Lưu Thiếu Kỳ.;B. Mao Trạch Đông.;C. Chu Ân Lai.;D. Lâm Bưu.;B
7;Câu 4; Sự kiện nào đánh dấu giai cấp công nhân Việt Nam đi vào đấu tranh tự giác?;A. Bãi công của thợ máy xưởng Ba Son - Sài Gòn (8/1925).;B. Cuộc bãi công của công nhân thợ nhuộm ở Chợ Lớn (1922).;C. Cuộc bãi công của 1000 công nhân nhà máy sợi Nam Định (1926).;D. Tổng bãi công của công nhân Bắc Kì (1922).;A
7;Câu 5; Đại hội Quốc tế Cộng sản lần thứ VII ( 7/1935) đã có những chủ trương gì?;A. Thành lập Đảng Cộng sản ở mỗi nước.;B. Thành lập Mặt trận nhân dân ở các nước thuộc địa.;C. Thành lập Mặt trận nhân dân ở các nước tư bản.;D. Thành lập Mặt trận nhân dân ở các nước.;D
7;Câu 6; Từ những năm 60 đến những năm 80 của thế kỉ XX, phong trào đấu tranh của nhân dân các nước Mĩ La-tinh diễn ra dưới hình thức nào?;A. Bãi công của công nhân.;B. Đấu tranh chính trị.;C. Đấu tranh vũ trang.;D. Sự nổi dậy của người dân.;C
7;Câu 7; Trước ảnh hưởng của cuộc khủng hoảng chung trên toàn thế giới trong những năm 70 của thế kỉ XX Liên Xô đã làm gì?;A. Kịp thời thay đổi để thích ứng với tình hình thế giới.;B. Tiến hành cải cách kinh tế, chính trị, xã hội cho phù hợp.;C. Không tiến hành những cải cách cần thiết về kinh tế và xã hội.;D. Có sửa đổi nhưng chưa triệt để.;C
7;Câu 8; Sự phát triển “thần kì của Nhật Bản” được biểu hiện rõ nhất ở điểm nào?;A. Năm 1968, tổng sản phẩm quốc dân đứng hàng thứ 2 trên thế giới sau Mĩ. (Nhật 183 tỉ USD, Mĩ 830 tỉ USD).;B. Trong khoảng hơn 20 năm (1950 - 1973), tổng sản phẩm quốc dân của Nhật Bản tăng 20 lần.;C. Từ thập niên 70 (thế kỉ XX) Nhật Bản trở thành 1 trong 3 trung tâm kinh tế tài chính của thế giới tư bản.(Mĩ, Tây Âu, Nhật Bản).;D. Từ nước chiến bại, hết sức khó khăn thiếu thốn, Nhật Bản vươn lên thành siêu cường kinh tế.;D
7;Câu 9; Thắng lợi quan trọng của Hiệp định Pa-ri đối với sự nghiệp kháng chiến chống Mĩ cứu nước là;A. làm phá sản hoàn toàn chiến lược “Việt Nam hóa chiến tranh” của đế quốc Mĩ.;B. tạo thời cơ thuận lợi để nhân dân ta tiến lên đánh cho “Mĩ cút, ngụy nhào”.;C. đã đánh cho “Mĩ cút, ngụy nhào”.;D. tạo thời cơ thuận lợi để nhân dân ta tiến lên đánh cho “ngụy nhào”.;D
7;Câu 10; Nội dung đường lối đổi mới đi lên chủ nghĩa xã hội ở nước ta là;A. thay đổi toàn diện, đồng bộ, trọng tâm là đổi mới kinh tế.;B. đổi mới lần lượt trên các lĩnh vực: kinh tế, chính trị, văn hóa,...;C. thay đổi toàn bộ mục tiêu chiến lược.;D. thay đổi toàn diện, đồng bộ, trọng tâm là đổi mới chính trị.;A
7;Câu 11; Âm mưu của Pháp, Mĩ trong việc vạch ra kế hoạch quân sự Na-va là;A. Lấy lại thế chủ động trên chiến trường chính Bắc Bộ.;B. Giành thắng lợi quân sự kết thúc chiến tranh trong vòng 18 tháng.;C. Xoay chuyển cục diện chiến tranh Đông Dương trong 18 tháng hi vọng “kết thúc chiến tranh trong danh dự”.;D. Giành thắng lợi quân sự kết thúc chiến tranh theo ý muốn.;C
7;Câu 12; Giai cấp tư sản Việt Nam bị phân hoá thành hai bộ phận nào?;A. Tư sản dân tộc và tư sản thương nghiệp.;B. Tư sản dân tộc và tư sản công nghiệp.;C. Tư sản dân tộc và tư sản mại bản.;D. Tư sản dân tộc và tư sản công thương.;C
7;Câu 13; Sau Chiến tranh thế giới thứ nhất, phong trào yêu nước theo khuynh hướng dân chủ tư sản phát triển mạnh mẽ vì;A. Chủ nghĩa Mác Lê-nin được truyền bá sâu rộng vào Việt Nam.;B. Do ảnh hưởng tư tưởng Tam dân của Tôn Trung Sơn.;C. Giai cấp công nhân đã chuyển sang đấu tranh tự giác.;D. Thực dân Pháp đang trên đà suy yếu.;B
7;Câu 14; Sự kiện nào dưới đây gắn với tên tuổi của Nen-Xơn Man-đê- la?;A. Chiến sĩ nổi tiếng chống ách thống trị của bọn thực dân.;B. Lãnh tụ của phong trào giải phóng dân tộc ở An-giê-ri.;C. Lãnh tụ của phong trào giải phóng dân tộc ở Ăng-gô-la.;D. Lãnh tụ của phong trào đấu tranh chống chế độ phân biệt chủng tộc ở Nam Phi.;D
7;Câu 15; Đảng Cộng sản Việt Nam ra đời là sản phẩm của sự kết hợp;A. Chủ nghĩa Mác-Lê nin với phong trào công nhân và phong trào nông dân.;B. Chủ nghĩa Mác-Lê nin với phong trào công nhân.;C. Chủ nghĩa Mác-Lê nin với phong trào công nhân và phong trào yêu nước.;D. Chủ nghĩa Mác-Lê nin với phong trào dân tộc, dân chủ.;C
7;Câu 16; Sự kiện nào trực tiếp đưa đến quyết định của Đảng và Chính phủ phát động toàn quốc kháng chiến chống Pháp?;A. Pháp đánh chiếm Lạng Sơn (11/1946).;B. Pháp đánh Hải Phòng (11/1946).;C. Pháp tấn công vào cơ quan Bộ Tài chính ở Hà Nội (12/1946);D. 18/12/1946 Pháp gửi tối hậu thư buộc ta giải tán lực lượng tự vệ chiến đấu, giao quyền kiểm soát thủ đô cho chúng.;D
7;Câu 17; Năm 1950, thực dân Pháp thực hiện kế hoạch Rơ-ve nhằm mục đích gì?;A. Mở một cuộc tiến công quy mô lớn vào căn cứ địa Việt Bắc.;B. Cô lập căn cứ địa Việt Bắc.;C. “Khoá cửa biên giới Việt - Trung”, thiết lập “Hành lang Đông - Tây” (từ Hải Phòng đến Sơn La).;D. Nhận được viện trợ về tài chính và quân sự của Mĩ.;C
7;Câu 18; Chính quyền cách mạng ở Nghệ-Tĩnh được gọi là chính quyền Xô viết vì;A. Chính quyền đầu tiên của công nông.;B. Chính quyền do giai cấp công nhân lãnh đạo.;C. Hình thức của chính quyền theo kiểu Xô viết (Nga).;D. Hình thức chính quyền theo kiểu nhà nước mới.;C
7;Câu 19; ASEAN là một tổ chức ra đời nhằm cùng nhau hợp tác trên lĩnh vực nào?;A. Kinh tế - văn hóa.;B. Kinh tế - quân sự.;C. Quân sự - chính trị.;D. Kinh tế.;A
7;Câu 20; Thực chất của chính sách “dùng người Việt đánh người Việt, lấy chiến tranh nuôi chiến tranh” của Pháp là;A. Thực hiện chiến lược đánh nhanh thắng nhanh.;B. Thực hiện chiến lược đánh lâu dài với ta.;C. Chuyển sang hình thức xâm lược thực dân mới.;D. Cuộc chiến tranh tổng lực.;B
7;Câu 21; Năm 1942, tỉnh nào được coi là nơi thí điểm của cuộc vận động xây dựng các Hội Cứu quốc quân trong Mặt trận Việt Minh?;A. Cao Bằng.;B. Bắc Cạn.;C. Lạng Sơn.;D. Tuyên Quang.;A
7;Câu 22; Nước nào mở đầu kỉ nguyên chinh phục vũ trụ?;A. Nhật.;B. Trung Quốc.;C. Liên Xô.;D. Mĩ.;C
7;Câu 23; Sau khi nước Đức phát xít đầu hàng, 4 nước nào sau đây đã phân chia lãnh thổ nước Đức thành 4 khu vực để chiếm đóng và kiểm soát?;A. Liên Xô, Trung Quốc, Mĩ, Anh.;B. Mĩ, Liên Xô, Trung Quốc, Nhật Bản.;C. Mĩ, Anh, Pháp, Nhật.;D. Liên Xô, Mĩ, Anh, Pháp.;D
7;Câu 24; Nhà máy điện nguyên tử đầu tiên trên thế giới được xây dựng tại đâu?;A. Mĩ.;B. Đức.;C. Liên Xô.;D. Trung Quốc.;C
7;Câu 25; Đến tháng 3/1938, tên gọi của mặt trận ở Đông Dương là gì?;A. Mặt trận Dân chủ thống nhất Đông Dương.;B. Mặt trận Thống nhất phản đế Đông Dương.;C. Mặt trận Nhân dân phản đế Đông Dương.;D. Mặt trận Dân tộc thống nhất phản đế Đông Dương.;A
7;Câu 26; Hội nghị Ban chấp hành Trung ương Đảng Cộng sản Đông Dương lần thứ VIII đã xác định mâu thuẫn cơ bản trong lòng xã hội Việt Nam là gì?;A. Mâu thuẫn giữa nhân dân ta với đế quốc phát xít Pháp-Nhật.;B. Mâu thuẫn giữa nhân dân ta với thực dân Pháp.;C. Mâu thuẫn giữa nhân dân ta với phát xít Nhật và phong kiến tay sai.;D. Mâu thuẫn giữa nhân dân ta với thực dân Pháp và phong kiến tay sai.;A
7;Câu 27; Biến đổi tích cực quan trọng đầu tiên của các nước Đông Nam Á sau Chiến tranh thế giới thứ hai là gì?;A. Từ các nước thuộc địa trở thành các nước độc lập.;B. Nhiều nước có tốc độ phát triển khá nhanh.;C. Ngày càng mở rộng đối ngoại, hợp tác với các nước Đông Á và EU.;D. Sự ra đời của khối ASEAN.;A
7;Câu 28; Phương hướng chiến lược của ta trong cuộc tiến công Đông- Xuân 1953-1954 là gì?;A. Trong vòng 18 tháng chuyển bại thành thắng.;B. Tập trung lực lượng tiến công vào những hướng chiến lược quan trọng mà địch tương đối yếu, tiêu diệt một bộ phận sinh lực địch, buộc chúng bị động phân tán lực lượng.;C. Tranh giao chiến ở miền Bắc để chuẩn bị đàm phán.;D. Giành thắng lợi nhanh chóng về quân sự trong Đông-Xuân 1953- 1954.;B
7;Câu 29; Nội dung nào sau đây không có trong “Trật tự hai cực I-an-ta”?;A. Trật tự thế giới mới hình thành sau chiến tranh.;B. Mĩ và Liên Xô chuyển từ đối đầu sang đối thoại, hợp tác.;C. Sự phân chia ảnh hưởng giữa Mĩ và Liên Xô trong quan hệ quốc tế.;D. Trật tự thế giới được hình thành sau hội nghị I-an-ta (04/1945).;B
7;Câu 30; Chiến thắng Vạn Tường (Quảng Ngãi) chứng tỏ điều gì?;A. Lực lượng vũ trang miền Nam đủ sức đương đầu và đánh bại quân viễn chinh Mĩ.;B. Lực lượng vũ trang miền Nam đã trưởng thành nhanh chóng.;C. Quân Viễn chinh Mĩ đã mất khả năng chiến đấu.;D. Cách mạng miền Nam đã giành thắng lợi trong việc đánh bại “Chiến tranh cục bộ” của Mĩ.;A
7;Câu 31; Vì sao cuộc chiến tranh phá hoại miền Bắc lần thứ hai được xem là một bộ phận của chiến lược “Việt Nam hóa chiến tranh” của đế quốc Mĩ?;A. Vì nó hỗ trợ cho chiến lược “Việt Nam hoá”.;B. Vì nhằm đối phó với cuộc tiến công của ta và hỗ trợ chiến lược “Việt Nam hóa” đang có nguy cơ phá sản.;C. Vì nhằm tạo thế mạnh vừa đánh, vừa đàm.;D. Vì nó thực hiện âm mưu phá hoại cách mạng miền Bắc để miền Bắc không còn đủ sức chi viện cho Miền Nam.;B
