4;Câu 17; Lực lượng cách mạng để đánh đổ đế quốc và phong kiến được nêu trong Cương lĩnh chính trị đầu tiên của Đảng do Nguyễn Ái Quốc khởi thảo là gì?;A. Công nhân và nông dân;B. Công nhân, nông dân, tiểu tư sản, tư sản và địa chủ phong kiến;C. Công nhân, nông dân và các tầng lớp tiểu tư sản, tri thức, trung nông;D. Công nhân, nông dân, tư sản;C
4;Câu 18; Quá trình phân hóa của Hội Việt Nam cách mạng thanh niên đã dẫn đến sự thành lập các tổ chức Cộng sản nào trong năm 1929?;A. Đông Dương Cộng sản Đảng, An Nam Cộng sản Đảng và Đông Dương Cộng sản liên đoàn;B. Đông Dương Cộng sản Đảng, Đông Dương Cộng sản liên đoàn;C. An Nam Cộng sản Đảng và Đông Dương Cộng sản liên đoàn;D. Đông Dương Cộng sản Đảng, An Nam Cộng sản Đảng;D
4;Câu 19; Trước khí thế đấu tranh của quần chúng công nông, bộ máy chính quyền của đế quốc và phong kiến tay sai ở nhiều địa phương thuộc Nghệ - Tĩnh bị tan rã. Các tổ chức Đảng ở địa phương đã kịp thời lãnh đạo nhân dân thực hiện quyền làm chủ, tự đứng ra quản lý đời sống của mình đó là kết quả của phong trào đấu tranh nào?;A. Phong trào cách mạng 1930-1931;B. Biểu tình 1/5/1930 trên toàn quốc;C. Biểu tình 12/9/1930 của nông dân huyện Hưng Nguyên ( Nghệ An);D. Đấu tranh vũ trang của nông dân, công nhân … tháng 9,10/1930;D
4;Câu 20; Sau đêm 9/3/1945 khẩu hiệu mà Đảng Cộng sản Đông Dương sử dụng là gì?;A. “ Diệt phát xít Nhật”;B. “Chống phát xít, chống chiến tranh”;C. “ Phá khi thóc Nhật, giải quyết nạn đói”;D. “Tự do, cơm áo, hòa bình”;C
4;Câu 21; Năm nước tham gia sáng lập tổ chức ASEAN năm 1967 là;A. Thái Lan, Philippin, Malaixia, Mianma, Xingapo;B. Indonexia, Thái Lan, Philippin, Malaixia, Xingapo;C. Thái Lan, Philippin, Malaixia, Mianma, Indonexia;D. Indonexia, Thái Lan, Philippin, Malaixia, Brunây;B
4;Câu 22; Nhiệm vụ của cách mạng miền Nam sau 1954 là gì?;A. Tiếp tục đấu tranh vũ trang chống thực dân Pháp;B. Chống “ tố tộng”, “diệt cộng”, đòi quyền tự do, dân chủ;C. Bảo vệ miền Bắc XHCN, để miền Bắc đủ sức chi viện cho miền Nam;D. Đấu tranh chính trị chống Mĩ – Diệm, đòi thi hành Hiệp định Giơ -ne-vơ, bảo vệ hòa bình;D
4;Câu 23; Vì sao lịch sử ghi nhận năm 1960 là năm của Châu Phi?;A. Cả 17 nước châu Phi giành được độc lập;B. Tất cả các nước châu Phi đều giành được độc lập;C. Hệ thống thuộc địa của đế quốc lần lượt tan rã;D. Chủ nghĩa thực dân sụp đổ ở châu Phi;A
4;Câu 24; Liên Xô chế tạo thành công bom nguyên tử vào năm nào?;A. 1947;B. 1945;C. 1949;D. 1951;C
4;Câu 25; Nơi nào hưởng ứng “Lời kêu gọi toàn quốc kháng chiến” của Chủ tịch Hồ Chí Minh đầu tiên?;A. Sài Gòn;B. Huế;C. Hà Nội;D. Nam Định;C
4;Câu 26; Đâu là trở ngại chủ quan ảnh hưởng đến thắng lợi của XHCN và Đông Âu;A. Chưa đảm bảo đầy đủ sự công bằng xã hội và quyền dân chủ của nhân dân;B. Sự trì trệ, thiếu năng động trước những biến động của tình hình thế giới;C. Sự phá hoại của các thế lực phản động;D. Rập khuôn, giáo điều theo mô hình xây dựng XHCN ở Liên Xô;D
4;Câu 27; Lý do nào là quan trọng nhất để Đảng ta chủ trương khi thì tạm hòa hoãn với Tưởng Giới Thạch để chống Pháp, khi thì hòa hoãn với Pháp để đuổi tưởng?;A. Tưởng dùng bọn tay sai Việt Quốc, Việt Cách để phá ta từ bên trong;B. Thực dân Pháp được sự giúp đỡ, hậu thuẫn của quân Anh;C. Chính quyền của ta còn non trẻ, không thể một lúc chống 2 kẻ thù mạnh;D. Tưởng có nhiều âm mưu chống phá cách mạng;C
4;Câu 28; Sau chiến tranh chống Nhật 1946-1949 ở Trung Quốc diễn ra sự kiện lịch sử quan trọng;A. Cách mạng Trung Quốc thắng lợi;B. Đảng Cộng sản và Quốc dân Đảng hợp tác;C. Liên Xô và Trung Quốc kí hiệp ước hợp tác;D. Nội chiến giữa Đảng Cộng sản và Quốc dân đảng;D
4;Câu 29; Vì sao ta mở chiến dịch Biên giới 1950?;A. Tạo điều kiện để thúc đẩy cuộc kháng chiến của ta tiến lên một bước;B. Khai thông biên giới, con đường liên lạc quốc tế giữa ta và Trung Quốc với các nước dân chủ thế giới;C. Tiêu diệt một bộ phận lực lượng địch, khai thông biên giới Việt Trung, mở rộng và củng cố căn cứ địa cách mạng tạo điều kiện đẩy mạnh cách mạng;D. Để đánh bại kế hoạch Rove;C
4;Câu 30; Ngày 11/3/1951 Hội nghị đại biểu của nhân dân 3 nước Đông Dương đã thành lập tổ chức nào?;A. Liên minh nhân dân Việt-Miên-Lào;B. Mặt trận Việt-Miên-Lào;C. Liên minh Việt-Miên-Lào;D. Mặt trận thống nhất Việt-Miên-Lào;A
4;Câu 31; Vạch trần chính sách đàn áp bọc lột dã man của chủ nghĩa đế quốc nói chung và đế quốc Pháp nói riêng, thức tỉnh các dân tộc bị áp bức nổi dậy đấu tranh tự giải phóng. Đó là nội dung của tờ báo nào?;A. Đời sống công nhân       ;B. Nhân đạo;C. Tạp chí thư tín quốc tế       ;D. Người cùng khổ;D
4;Câu 32; Phong trào yêu nước dân tộc dân chủ công khai diễn ra từ;A. 1919-1926       ;B. 1919-1925;C. 1919-1927       ;D. 1919-1928;B
4;Câu 33; Địa điểm nổ ra cuộc khởi nghĩa Yên Bái ( 9/2/1930)?;A. Yên Bái, Hà Nội, Phú Thọ;B. Yên Bái, Phú Thọ, Hải Dương, Thái Bình;C. Yên Bái;D. Yên Bái, Hải Phòng, Hà Nội;B
4;Câu 34; Âm mưu thâm độc nhất của “ Chiến tranh đặc biệt” là gì?;A. Dùng người Việt đánh người Việt;B. Sử dụng phương tiện chiến tranh và “cố vấn” Mĩ;C. Tiến hành dồn dân, lập “ấp chiến lược”;D. Phá hoại cách mạng miền Bắc;A
4;Câu 35; Biến đổi lớn nhất của các nước châu Á sau Chiến tranh thế giới thứ hai là gì?;A. Các nước châu Á đã giành được độc lập.;B. Các nước châu Á đã gia nhập ASEAN.;C. Các nước châu Á đã trở thành trung tâm kinh tế tài chính thế giới.;D. Tất cả các câu trên.;A
4;Câu 36; Phương châm chiến lược của ta trong Đông-Xuân 1953-1954 là gì?;A. “Đánh nhanh, thắng nhanh”;B. “ Tích cực, chủ động, cơ động, linh hoạt”, “ Đánh ăn chắc Đánh chắc thắng”;C. “Đánh chắc, thắng chắc”;D. “ Đánh vào những nơi ta cho là chắc thắng”;B
4;Câu 37; Điều nào sau đây chứng tỏ chính quyền, quân đội Sài Gòn phá hoại Hiệp định Pari?;A. Tiến hành chiến dịch “ tràn ngập lãnh thổ”, mở những cuộc hành quân” bình định lấn chiếm” vùng giải phóng;B. Nhận viện trợ kinh tế của Mĩ;C. Nhận viện trợ quân sự của Mĩ;D. Lập Bộ chỉ huy quân sự;A
4;Câu 38; Mục đích bao quát nhất của “chiến tranh lạnh” do Mĩ phát động là gì?;A. Ngăn chặn và tiến tới tiêu diệt các nước XHCN;B. Bắt các nước đồng minh lệ thuộc Mĩ;C. Đàn áp phong trào giải phóng dân tộc và phong trào cách mạng thế giới;D. Thực hiện “ Chiến lược toàn cầu” làm bá chủ thế giới của đế quốc Mĩ;D
4;Câu 39; Thực hiện nghĩa vụ hậu phương lớn đối với tiền tuyến, miền Bắc sẵn sàng với tinh thần gì?;A. Tất cả vì tiền tuyến;B. Tất cả để chiến thắng;C. Mỗi người làm việc bằng hai;D. Thóc không thiếu một cân, quân không thiếu một người;D
4;Câu 40; Để đẩy lùi nạn đói, biện pháp nào là quan trọng nhất?;A. Lập hũ gạo tiết kiệm;B. Tổ chức ngày đồng tâm để có thêm gạo cứu đói;C. Đẩy mạnh tăng gia sản xuất;D. Chia lại ruộng công cho nông dân theo nguyên tắc công bằng và dân chủ;C

5;Câu 1; Những tờ báo tiến bộ của các tầng lớp tiểu tư sản trong những năm 1919-1926 là;A. Thanh niên, Chuông rè, An Nam trẻ;B. Chuông rè, An Nam trẻ, Người nhà quê;C. Người nhà quê, An Nam trẻ, Thanh niên;D. Chuông rè, Tin tức, Thanh niên;B
5;Câu 2; Yếu tố nào được xem là “xương sống” của chiến lược “Chiến tranh đặc biệt”?;A. Ngụy quân;B. Ngụy quyền;C. “Ấp chiến lược”;D. Đô thị (hậu cứ);C
5;Câu 3; Sự phân hóa của Tân Việt cách mạng Đảng đã dẫn đến thành lập tổ chức Cộng sản nào ở Việt Nam năm 1929?;A. Đông Dương Cộng sản Đảng;B. An Nam Cộng sản Đảng;C. Đông Dương Cộng sản Đảng và Đông Dương Cộng sản liên đoàn;D. Đông Dương Cộng sản liên đoàn;D
5;Câu 4; Từ sau Chiến tranh thế giới thứ hai phong trào giải phóng dân tộc ở châu Phi nổ ra sớm nhất ở nước nào?;A. Bắc Phi;B. Tây Phi;C. Nam Phi;D. Đông Phi;A
5;Câu 5; Quan hệ quốc tế sau 1945 là sự xác lập trật tự thế giới nào?;A. Đơn cực nhiều trung tâm;B. Hai cực;C. Một cực;D. Đa cực;B
5;Câu 6; Trong những thành tựu bước đầu của công cuộc đổi mới, thành tựu nào quan trọng nhất?;A. Phát triển kinh tế đối ngoại;B. Thực hiện được 3 chương trình kinh tế;C. Từng bước đưa đất nước thoát khỏi khủng hoảng kinh tế - xã hội;D. Kiềm chế được làm phát;B
5;Câu 7; Hội nghị toàn quốc của Đảng họp từ ngày 13 đến 15/8/1945 đã quyết định vấn đề gì?;A. Khởi nghĩa giành chính quyền trong cả nước;B. Tổng khởi nghĩa giành chính quyền trong cả nước;C. Khởi nghĩa giành chính quyền ở Hà Nội, Huế, Sài Gòn;D. Tổng khởi nghĩa trong cả nước, giành lấy chính quyền trước khi quân Đồng minh vào;D
5;Câu 8; Đồng tiền chung châu Âu với tên gọi EURO phát hành từ ngày:;A. 01/01/1999;B. 01/02/1999;C. 01/03/1999;D. 01/04/1999;A
5;Câu 9; Biện pháp nào quan trọng nhất để chính quyền cách mạng kịp thời giải quyết khó khăn về tài chính sau Cách mạng tháng Tám?;A. Tiết kiệm chi tiêu;B. Quốc hội quyết định cho lưu hành tiền Việt Nam trong cả nước (23/11/1941);C. Động viên lòng nhiệt tình yêu nước và ủng hộ Chính phủ của nhân dân;D. Chính phủ ký sắc lệnh phát hành tiền Việt Nam (31/1/1946);C
5;Câu 10; Phi-đen Cax-tơ-rô tuyên bố Cu Ba tiến lên chủ nghĩa xã hội trong hoàn cảnh nào?;A. Mĩ bao vây cấm vận;B. Đất nước đã lật đổ chế độ độc tài BatixtA;C. Mất nguồn viện trợ to lớn từ khi Liên Xô tan rã;D. Trong giờ phút quyết liệt của cuộc chiến đấu tiêu diệt đội quân đánh thuê của Mĩ tại bãi biển Hi-rôn;D
5;Câu 11; Bốn ghế Bộ trưởng trong Chính phủ Liên hiệp mà Quốc hội nước ta đã nhường cho phái thân Tưởng đó những bộ nào?;A. Ngoại giao, kinh tế, giáo dục, xã hội;B. Ngoại giao, kinh tế, canh nông, xã hội;C. Kinh tế, giáo dục, canh nông, xã hội;D. Ngoại giao, giáo dục, canh nông, xã hội;B
5;Câu 12; Ở Đông Dương năm 1940 thực dân Pháp đứng trước 2 nguy cơ nào?;A. Đầu hàng Nhật, vừa đàn áp nhân dân Đông Dương;B. Đánh bại Nhật, vừa đàn áp nhân dân Đông Dương;C. Ngọn lửa cách mạng giải phóng dân tộc của nhân dân Đông Dương sớm muộn sẽ bùng nổ, phát xít Nhật đang lăm lê hất cẳng Pháp;D. Cấu kết với Nhật để đàn áp nhân dân Đông Dương;C
5;Câu 13; Chính sách đối ngoại của Trung Quốc từ những năm 80 của thế kỷ XX đến nay là;A. Mở rộng quan hệ hữu nghị, hợp tác với các nước trên thế giới;B. Gây chiến tranh xâm lược biên giới phía Bắc Việt Nam;C. Thực hiện đường lối đối ngoài bất lợi cho cách mạng Trung Quốc;D. Bắt tay với Mỹ chống lại Liên Xô;A
5;Câu 14; Những thủ đoạn thâm độc nhất của tư bản Pháp về chính trị sau Chiến tranh thế giới thứ nhất nhằm nô dịch lâu dài nhân dân Việt Nam là gì?;A. Thâu tóm quyền hành trong tay người Pháp;B. Câu kết với vua quan Nam triều để đàn áp nhân dân;C. “Chia để trị”;D. Khủng bố, đàn áp nhân dân ta;C
5;Câu 15; Liên Xô quyết định sử dụng năng lượng nguyên tử vào mục đích gì?;A. Khống chế các nước khác;B. Duy trì nền hòa bình thế giới;C. Ủng hộ phong trào cách mạng thế giới;D. Mở rộng lãnh thổ;B
5;Câu 16; Ý nghĩa lịch sử của cuộc khởi nghĩa Yên Bái?;A. Góp phần cổ vũ lòng yêu nước và chí căm thù của nhân dân ta đối với bè lũ cướp nước và tay sai;B. Chấm dứt vai trò lãnh đạo cách mạng của giai cấp tư sản dân tộc đối với cách mạng Việt Nam;C. Đánh dấu sự khủng hoảng của khuynh hướng cách mạng dân chủ tư sản;D. Việt Nam Quốc dân Đảng đáp ứng một phần yêu cầu của nhiệm vụ dân tộc của nhân dân ta;A
5;Câu 17; Lực lượng nào giữ vai trò quan trọng nhất trong chiến lược “Chiến tranh cục bộ” của Mĩ ở Miền Nam Việt Nam?;A. Quân đội Mĩ, quân đồng minh;B. Quân đội Mĩ, quân đồng minh và quân đội Sài Gòn;C. Quân đội Sài Gòn, quân đồng minh;D. Quân đội Mĩ và quân đội Sài Gòn;A
5;Câu 18; Nội dung của Hội nghị thành lập Đảng là gì?;A. Thông qua Luận cương Chính trị của Đảng;B. Thông qua Chính Cương, Sách lược văn tắt, Điều lệ tóm tắt của Đảng và chỉ thị Ban Chấp hành Trung ương lâm thời;C. Bầu Ban Chấp hành Trung ương lâm thời;D. Quyết định lấy tên Đảng là Đảng Cộng sản Đông Dương;B
5;Câu 19; Tập trung lực lượng mở những cuộc tiến công vào những hướng quan trọng về chiến lược mà địch tương đối yếu, nhằm tiêu diệt một bộ phận sinh lực địch, giải phóng đất đai, đồng thời buộc chúng phải bị động đối phó .. Đó là phương hướng chiến lược của ta trong;A. Phá sản kế hoạch Na-va;B. Chiến dịch Tây Bắc;C. Đông-Xuân 1953-1954;D. Chiến dịch Điện Biên Phủ;C
5;Câu 20; Hai khẩu hiệu nào dưới đây được Đảng ta vận dụng trong phong trào cách mạng 1930-1931?;A. “Độc lập dân tộc” và “Ruộng đất dân cày”;B. “Tự do dân chủ” và “ Cơm áo hòa bình”;C. “ Tịch thu ruộng đất của đế quốc Việt gian” và “ Tịch thu ruộng đất của địa chủ phong kiến”;D. “Đánh đổ đế quốc” và “ Xóa bỏ ngôi vua”;A
5;Câu 21; Đảng Cộng sản Đông Dương đề ra nhiệm vụ trước mắt của nhân dân Đông Dương thời kỳ 1936-1939 là gì?;A. Chống phát xít, chống chiến tranh;B. Chống bọn phản động thuộc địa và tay sai;C. Chống phát xít, chống chiến tranh, chống bọn phản động thuộc địa và tay sai, đòi tự do dân chủ, cơm áo, hòa bình;D. Chống thực dân Pháp giành độc lập và chống phong kiến đòi ruộng đất cho dân cày;C
5;Câu 22; Trong quá trình triển khai chiến lược toàn cầu Mĩ, Mĩ đã thu được một số kết quả ngoại trừ việc;A. Ngăn chặn đẩy lùi được CNXH trên phạm vi toàn thế giới;B. Lôi kéo được nhiều nước đồng minh đi theo và ủng hộ Mĩ;C. Làm chậm quá trình giành độc lập của nhiều nước trên thế giới;D. Làm cho nhiều nước bị chia cắt trong thời gian dài;A
5;Câu 23; Câu thơ sau đây của nhà thơ Chế Lan Viên phù hợp với sự kiện nào trong cuộc đời hoạt động của Nguyễn Ái Quốc: “Phút khóc đầu tiên là phút Bác Hồ cười”?;A. Khi Người đọc luận cương của Lê-nin về vấn đề dân tộc và thuộc địa;B. Khi Người dự Đại hội Quốc tế Cộng sản lần thứ V (1924);C. Khi Người sáng lập ra Hội liên hiệp thuộc địa ở Pari;D. Khi Người viết bài và làm chủ nhiệm tờ báo “Người cùng khổ”;A
5;Câu 24; Tính chất nhân dân của cuộc kháng chiến của ta biểu hiện ở điểm nào?;A. Nội dung kháng chiến toàn dân của Đảng ta;B. Mục đích kháng chiến của Đảng ta;C. Quyết tâm kháng chiến của toàn thể dân tộc ta;D. Đường lối kháng chiến của Đảng ta;A
5;Câu 25; Khi Nhật đảo chính Pháp, Ban thường vụ Trung ương Đảng họp hội nghị mở rộng nhận định kẻ thù chính cụ thể trước mắt của nhân dân Đông Dương lúc này là ai?;A. Thực dân Pháp;B. Phát xít Nhật;C. Phát xít Pháp -Nhật;D. Phát xít Nhật và phong kiến nhà Nguyễn;B
5;Câu 26; Một trong những dấu hiệu chứng tỏ Nhật Bản là siêu cường tài chính số 1 thế giới trong nửa sau những năm 80 là gì?;A. Dữ trữ vàng và ngoại tệ gấp 2 lần Mĩ, gấp 1,5 lần CHLB Đức, là chủ nợ của thế giới;B. Là chủ nợ của thế giới, dự trữ vàng và ngoại tệ gấp 2,5 lần CHLB Đức, gấp 3 lần của Mĩ;C. Là chủ nợ lớn nhất thế giới dự trữ vàng và ngoại tệ gấp 1,5 lần CHDC Đức, gấp 3 lần của Mĩ;D. Dự trữ vàng và ngoại tệ gấp 3 lần của Mĩ, gấp 1,5 lần CHLB Đức, là chủ nợ lớn nhất thế giới;D
5;Câu 27; Trong các nội dung sau, nội dung nào không có trong Hiệp định Giơ-ne-vơ?;A. Ngày 20/7/1956 Việt Nam sẽ tổng tuyển cử tự do trong cả nước để thống nhất nước Việt Nam;B. Để cho nhân dân Miền Nam tự quyết định tương lai chính trị của mình;C. Hiệp định công nhận độc lập chủ quyền, thống nhất và toàn vẹn lãnh thổ của 3 nước Đông Dương;D. Hiệp định qui định ngừng bắn, thời gian chuyển quân tập kết theo giới tuyến quân sự tạm thời là vĩ tuyến 17, cấm 2 bên trả thù những người cộng tác với đối phương;B
5;Câu 28; Nguyên nhân cơ bản làm cho chủ nghĩa xã hội ở Liên Xô và Đông Âu sụp đổ?;A. Các thế lực chống CNXH trong và ngoài nước chống phá;B. Nhà nước nhân dân Xô viết, nhận thấy CNXH không tiến bộ nên muốn thay đổi chế độ;C. Chậm sửa chữa những sai lầm;D. Xây dựng mô hình chủ nghĩa xã hội không phù hợp;D
5;Câu 29; Đại hội Đảng lần thứ II quyết định Đảng ra hoạt động công khai với tên mới là gì?;A. Đảng Cộng sản Đông Dương;B. Đảng Cộng sản Việt Nam;C. Đảng Lao động Việt Nam;D. Đảng Cộng sản Liên đoàn;C
5;Câu 30; Kết quả lớn nhất của ta trong chiến dịch Biên giới 1950 là gì?;A. Loại khỏi vòng chiến đấu hơn 8000 quân địch;B. Giải phóng vùng biên giới Việt Trung dài 750 km từ Cao Bằng đến Đình Lập với 35 vạn dân;C. Hàng lang Đông- Tây bị chọc thủng ở Hòa Bình;D. Bảo vệ căn cứ địa Việt Bắc. Kế hoạch Rơve của Pháp bị phá sản;D
5;Câu 31; Cách mạng miền Nam có vai trò như thế nào trong việc đánh đổ ách thống trị của đế quốc Mĩ và tay sai của chúng, giải phóng miền Nam, thống nhất đất nước?;A. Có vai trò quan trọng nhất;B. Có vai trò cơ bản nhất;C. Có vai trò quyết định trực tiếp;D. Có vai trò quyết định nhất;C
5;Câu 32; Khối NATO còn gọi là khối gì?;A. Khối Tây Nam Đại Tây Dương;B. Khối Bắc Đại Tây Dương;C. Khối Nam Đại Tây Dương;D. Khối Đông Đại Tây Dương;B
5;Câu 33; Tại Hội nghị Ban chấp hành Trung ương Đảng lần VIII, Hội nghị đã chủ trương thành lập mặt trận nào?;A. Mặt trận nhân dân phản đế Đông Dương;B. Mặt trận Liên Việt;C. Mặt trận Đồng minh;D. Việt Nam độc lập đồng minh( gọi tắt là Việt Minh);D
5;Câu 34; Thắng lợi tiêu biểu nhất trong các hoạt động quân sự Đông- Xuân 1974-1975 là gì?;A. Đánh bại cuộc hành quân “Lam Sơn 719” của Mĩ-Ngụy;B. Chiến thắng Đường 9 – Nam Lào;C. Chiến dịch Đường 14 – Phước Long;D. Chiến dịch Tây Nguyên;C
5;Câu 35; Điểm khác nhau cơ bản của khoa học khác với kĩ thuật là gì?;A. Khoa học trở thành lực lượng sản xuất trực tiếp;B. Khoa học tạo điều kiện để kĩ thuật phát triển;C. Khoa học cơ bản đi trước kĩ thuật;D. Khoa học phát minh, phát hiện các quy luật trong các lĩnh vực Toán, Lý, Hóa, Sinh;A
5;Câu 36; Đến giữa những năm 90 của thế kỷ XX, ở khu vực Đông Nam Á diễn ra tình hình nổi bật là;A. Hầu hết các quốc gia trong khu vực đã giành được độc lập;B. Các nước tham gia khối phòng thủ chung Đông Nam Á (SEATO);C. Tất cả các quốc gia trong khu vực đã giành được độc lập;D. Các nước tiếp tục chịu sự thống trị của chủ nghĩa thực dân mới;A
5;Câu 37; Năm 1997, ASEAN đã kết nạp thêm các thành viên nào?;A. Lào, Việt Nam;B. Mi-an-ma, Việt Nam;C. Cam-pu-chia, Lào;D. Lào, Mi-an-ma;D
5;Câu 38; Tháng 9/1975, Hội nghị Ban Chấp hành Trung ương Đảng lần thứ 24 đã đề ra nhiệm vụ gì?;A. Cải tạo XHCN;B. Bầu cử Quốc hội thống nhất;C. Hoàn thành thống nhất đất nước về mặt nhà nước;D. Bầu Ban Dự thảo Hiến pháp;C
5;Câu 39; Trong cuộc khai thác thuộc địa lần thứ hai của thực dân Pháp ở Đông Dương có hai giai cấp bị phân hóa thành hai bộ phận, đó là các giai cấp nào?;A. Giai cấp tư sản dân tộc và tầng lớp tiểu tư sản;B. Giai cấp đại địa chủ phong kiến và giai cấp tư sản;C. Giai cấp công nhân và giai cấp tư sản;D. Giai cấp nông dân và giai cấp công nhân;B
5;Câu 40; Ý nghĩa lịch sử nào là cơ bản nhất của cuộc tiến công chiến l972?;A. Đã mở ra một bước ngoặt của cuộc kháng chiến chống Mĩ của nhân dân ta;B. Đã giáng một đòn nặng nề vào chiến lược “Việt Nam hóa chiến tranh”;C. Đã giáng một đòn nặng nề vào quân ngụy ( công cụ chủ yếu) của Mĩ;D. Buộc Mĩ tuyên bố “Mĩ hóa” trở lại chiến tranh xâm lược, phải thừa nhận thất bại của chiến lược “Việt Nam hòa chiến tranh”;D

6;Câu 1; Trong quá trình xây dựng CNXH ở Liên Xô (từ 1950 đến nửa đầu những năm 70 của thế kỉ XX), số liệu nào sau đây có ý nghĩa nhất?;A. Nếu năm 1950, Liên Xô sản xuất được 27,3 triệu tấn thép thì đến năm 1970 sản xuất được 115,9 triệu tấn.;B. Từ năm 1951 đến 1975, mức tăng trưởng của Liên Xô hàng năm đạt 9,6%.;C. Năm 1950, tổng sản lượng công nghiệp của Liên Xô tăng 73% so với trước chiến tranh.;D. Từ giữa thập niên 70, sản xuất công nghiệp của Liên Xô đạt khoảng 20% sản lượng công nghiệp của toàn thế giới.;D
6;Câu 2; Công cuộc cải tổ của M. Goóc-ba-chốp bắt đầu từ năm nào?;A. 1985.       ;B. 1986.;C. 1987.       ;D. 1988.;A
6;Câu 3; Chủ trương đổi mới Đại hội Đảng lần VI là gì?;A. Thực hiện công nghiệp hóa và hiện đại hóa đất nước.;B. Ưu tiên phát triển công nghiệp nặng trên cơ sở phát triển nông nghiệp và công nghiệp nhẹ.;C. Phát triển nền kinh tế theo cơ chế thị trường.;D. Phát triển kinh tế hàng hóa nhiều thành phần, vận động theo cơ chế thị trường có sự quản lý của Nhà nước.;D
6;Câu 4; Ý nghĩa lịch sử của việc thành lập nước CHND Trung Hoa là;A. Hoàn thành cuộc cách mạng dân tộc dân chủ của nhân dân Trung Quốc, đưa Trung Quốc bước vào kỉ nguyên độc lập, tự do, tiến lên chủ nghĩa xã hội.;B. Hoàn thành cách mạng xã hội chủ nghĩa, kỉ nguyên xây dựng chủ nghĩa Cộng sản bắt đầu.;C. Lật đổ chế độ phong kiến.;D. Làm cho chủ nghĩa xã hội lan rộng khắp toàn cầu.;A
